{
  "schema_version": "1",
  "subject": {
    "name": "ООО «Пример-Строй» (вымышленная компания)",
    "inn": "0000000000",
    "kpp": null,
    "ogrn": null,
    "sro": [
      {
        "kind": "build",
        "name": "Ассоциация «Пример СРО строителей»",
        "reg_number": "С-000-00000000",
        "vv_level": 2,
        "odo_level": 2,
        "source": "выписка из реестра от 01.09.2026 (условно)"
      },
      {
        "kind": "design",
        "name": "Ассоциация «Пример СРО проектировщиков»",
        "reg_number": "П-000-00000000",
        "vv_level": 1,
        "odo_level": 1,
        "source": "выписка из реестра от 01.09.2026 (условно)"
      }
    ],
    "notes": "Учебный пример: все названия, номера и суммы вымышлены."
  },
  "as_of": "2026-09-01",
  "settings": {
    "vat_basis": "with_vat",
    "review_threshold": 0.7,
    "default_object_category": "unknown"
  },
  "objects": [
    {
      "id": "obj_zhk",
      "name": "Жилой дом со встроенными помещениями, 12 этажей",
      "address": "г. Пример, ул. Строителей, уч. 1",
      "cadastral": null,
      "category": "ordinary",
      "category_source": "проектная документация: жилой дом высотой 38 м, не относится к ст. 48.1 ГрК РФ",
      "notes": null
    },
    {
      "id": "obj_school",
      "name": "Школа на 550 мест (капитальный ремонт)",
      "address": "г. Пример, ул. Школьная, 5",
      "cadastral": null,
      "category": "unknown",
      "category_source": null,
      "notes": "Категория объекта не подтверждена — работы со звёздочкой ждут решения"
    }
  ],
  "contracts": [
    {
      "id": "ctr_1",
      "number": "ГП-01/2026",
      "date": "2026-02-10",
      "subject": "Строительство жилого дома со встроенными помещениями (генеральный подряд)",
      "kind": "construction",
      "sro_kind": "build",
      "role": "contractor",
      "counterparty": {
        "name": "ООО «СЗ Пример-Девелопмент»",
        "inn": "0000000001",
        "kind": "developer",
        "kind_source": "разрешение на строительство № 00-000-2025 выдано контрагенту"
      },
      "procurement": "competitive",
      "price_rub": 122000000.0,
      "price_without_vat_rub": 100000000.0,
      "status": "active",
      "object_id": "obj_zhk",
      "period_from": "2026-02-15",
      "period_to": "2027-06-30",
      "addenda": [],
      "source": {
        "document_id": "doc_ctr1",
        "page": 1,
        "quote": "Цена договора составляет 122 000 000 рублей, в том числе НДС 22 %"
      },
      "notes": null
    },
    {
      "id": "ctr_2",
      "number": "СП-07/2026",
      "date": "2026-04-01",
      "subject": "Монтаж внутренних инженерных систем (субподряд)",
      "kind": "construction",
      "sro_kind": "build",
      "role": "contractor",
      "counterparty": {
        "name": "ООО «Генстрой-Пример»",
        "inn": "0000000002",
        "kind": "general_contractor",
        "kind_source": "текст договора: заказчик — генеральный подрядчик застройщика"
      },
      "procurement": "direct",
      "price_rub": 24400000.0,
      "price_without_vat_rub": 20000000.0,
      "status": "active",
      "object_id": "obj_zhk",
      "period_from": null,
      "period_to": null,
      "addenda": [],
      "source": {
        "document_id": "doc_ctr2",
        "page": 1,
        "quote": null
      },
      "notes": "Субподряд: в совокупный размер не входит"
    },
    {
      "id": "ctr_3",
      "number": "ПД-03/2026",
      "date": "2026-03-05",
      "subject": "Разработка проектной и рабочей документации школы",
      "kind": "design",
      "sro_kind": "design",
      "role": "contractor",
      "counterparty": {
        "name": "МКУ «Управление капитального строительства г. Пример»",
        "inn": "0000000003",
        "kind": "technical_customer",
        "kind_source": "муниципальный контракт, заказчик выполняет функции техзаказчика"
      },
      "procurement": "competitive",
      "price_rub": 6100000.0,
      "price_without_vat_rub": 5000000.0,
      "status": "active",
      "object_id": "obj_school",
      "period_from": null,
      "period_to": null,
      "addenda": [],
      "source": {
        "document_id": "doc_ctr3",
        "page": 1,
        "quote": null
      },
      "notes": null
    },
    {
      "id": "ctr_4",
      "number": "ОХР-11/2026",
      "date": "2026-02-20",
      "subject": "Услуги по охране строительной площадки",
      "kind": "services",
      "sro_kind": null,
      "role": "customer",
      "counterparty": {
        "name": "ООО ОП «Пример-Безопасность»",
        "inn": "0000000004",
        "kind": "other",
        "kind_source": null
      },
      "procurement": "direct",
      "price_rub": 2220000.0,
      "price_without_vat_rub": null,
      "status": "active",
      "object_id": "obj_zhk",
      "period_from": null,
      "period_to": null,
      "addenda": [],
      "source": {
        "document_id": "doc_upd4",
        "page": 1,
        "quote": null
      },
      "notes": "Компания здесь заказчик; услуги — не подряд"
    },
    {
      "id": "ctr_5",
      "number": "КР-05/2026",
      "date": "2026-05-12",
      "subject": "Капитальный ремонт кровли школы",
      "kind": "construction",
      "sro_kind": "build",
      "role": "contractor",
      "counterparty": {
        "name": "МКУ «Управление капитального строительства г. Пример»",
        "inn": "0000000003",
        "kind": "technical_customer",
        "kind_source": null
      },
      "procurement": "competitive",
      "price_rub": 8500000.0,
      "price_without_vat_rub": null,
      "status": "active",
      "object_id": "obj_school",
      "period_from": null,
      "period_to": null,
      "addenda": [],
      "source": {
        "document_id": "doc_ctr5",
        "page": 1,
        "quote": null
      },
      "notes": "Цена ниже порога 10 млн ₽ — членство по этому договору не требуется"
    }
  ],
  "documents": [
    {
      "id": "doc_ctr1",
      "contract_id": "ctr_1",
      "kind": "contract",
      "calc_role": null,
      "number": "ГП-01/2026",
      "date": "2026-02-10",
      "period_from": null,
      "period_to": null,
      "amount_without_vat_rub": 100000000.0,
      "vat_rub": 22000000.0,
      "vat_rate": "22%",
      "amount_with_vat_rub": 122000000.0,
      "file": "dogovor-gp-01.pdf",
      "pages": 24,
      "extracted_by": "human",
      "extraction_confidence": 1.0,
      "notes": null
    },
    {
      "id": "doc_est1",
      "contract_id": "ctr_1",
      "kind": "estimate",
      "calc_role": null,
      "number": "ЛС-1",
      "date": "2026-02-10",
      "period_from": null,
      "period_to": null,
      "amount_without_vat_rub": 100000000.0,
      "vat_rub": 22000000.0,
      "vat_rate": "22%",
      "amount_with_vat_rub": 122000000.0,
      "file": "smeta-gp-01.xlsx",
      "pages": null,
      "extracted_by": "human",
      "extraction_confidence": 1.0,
      "notes": "Сводная смета — приложение № 1 к договору"
    },
    {
      "id": "doc_ks2_1",
      "contract_id": "ctr_1",
      "kind": "ks2",
      "calc_role": null,
      "number": "1",
      "date": "2026-06-30",
      "period_from": "2026-02-15",
      "period_to": "2026-06-30",
      "amount_without_vat_rub": 35000000.0,
      "vat_rub": 7700000.0,
      "vat_rate": "22%",
      "amount_with_vat_rub": 42700000.0,
      "file": "ks2-1.pdf",
      "pages": 3,
      "extracted_by": "claude",
      "extraction_confidence": 0.8,
      "notes": "скан"
    },
    {
      "id": "doc_ks3_1",
      "contract_id": "ctr_1",
      "kind": "ks3",
      "calc_role": null,
      "number": "1",
      "date": "2026-06-30",
      "period_from": "2026-02-15",
      "period_to": "2026-06-30",
      "amount_without_vat_rub": 35000000.0,
      "vat_rub": 7700000.0,
      "vat_rate": "22%",
      "amount_with_vat_rub": 42700000.0,
      "file": "ks3-1.pdf",
      "pages": 1,
      "extracted_by": "claude",
      "extraction_confidence": 0.8,
      "notes": "дублирует КС-2 № 1, справочно"
    },
    {
      "id": "doc_ctr2",
      "contract_id": "ctr_2",
      "kind": "contract",
      "calc_role": null,
      "number": "СП-07/2026",
      "date": "2026-04-01",
      "period_from": null,
      "period_to": null,
      "amount_without_vat_rub": 20000000.0,
      "vat_rub": 4400000.0,
      "vat_rate": "22%",
      "amount_with_vat_rub": 24400000.0,
      "file": "dogovor-sp-07.pdf",
      "pages": 10,
      "extracted_by": "human",
      "extraction_confidence": 1.0,
      "notes": null
    },
    {
      "id": "doc_ks2_2",
      "contract_id": "ctr_2",
      "kind": "ks2",
      "calc_role": null,
      "number": "1",
      "date": "2026-07-31",
      "period_from": "2026-07-01",
      "period_to": "2026-07-31",
      "amount_without_vat_rub": 4000000.0,
      "vat_rub": 880000.0,
      "vat_rate": "22%",
      "amount_with_vat_rub": 4880000.0,
      "file": "ks2-sp-1.pdf",
      "pages": 2,
      "extracted_by": "claude",
      "extraction_confidence": 0.8,
      "notes": null
    },
    {
      "id": "doc_ctr3",
      "contract_id": "ctr_3",
      "kind": "contract",
      "calc_role": null,
      "number": "ПД-03/2026",
      "date": "2026-03-05",
      "period_from": null,
      "period_to": null,
      "amount_without_vat_rub": 5000000.0,
      "vat_rub": 1100000.0,
      "vat_rate": "22%",
      "amount_with_vat_rub": 6100000.0,
      "file": "kontrakt-pd-03.pdf",
      "pages": 14,
      "extracted_by": "human",
      "extraction_confidence": 1.0,
      "notes": null
    },
    {
      "id": "doc_est3",
      "contract_id": "ctr_3",
      "kind": "estimate",
      "calc_role": null,
      "number": "Калькуляция",
      "date": "2026-03-05",
      "period_from": null,
      "period_to": null,
      "amount_without_vat_rub": 5000000.0,
      "vat_rub": 1100000.0,
      "vat_rate": "22%",
      "amount_with_vat_rub": 6100000.0,
      "file": "kontrakt-pd-03.pdf",
      "pages": 12,
      "extracted_by": "human",
      "extraction_confidence": 1.0,